{
  "$schema": "https://json-schema.org/draft/2020-12/schema",
  "$id": "https://solidprivacy.nl/schemas/dpia_analysis_request.schema.json",
  "title": "SolidPrivacy DPIA Analysis Request",
  "type": "object",
  "required": ["id", "case_id", "task", "jurisdiction", "evidence_pack", "legal_context_request", "privacy_context", "requested_provider", "requested_model", "prompt_version"],
  "properties": {
    "id": {"type": "string", "minLength": 1},
    "case_id": {"type": "string", "minLength": 1},
    "task": {"const": "draft_dpia_analysis"},
    "jurisdiction": {"type": "array", "items": {"type": "string"}, "minItems": 1, "uniqueItems": true},
    "evidence_pack": {"$ref": "evidence_pack.schema.json"},
    "privacy_context": {"$ref": "model_call_request.schema.json#/$defs/privacyContext"},
    "requested_provider": {"type": "string", "minLength": 1},
    "requested_model": {"type": "string", "minLength": 1},
    "prompt_version": {"type": "string", "minLength": 1},
    "legal_context_request": {"$ref": "legal_context_request.schema.json"}
  },
  "additionalProperties": false
}
