{"id":"DPIA-AN-REQ-001","case_id":"SYN-AI-FACT-001","task":"draft_dpia_analysis","jurisdiction":["EU/EEA","NL"],"evidence_pack":{"id":"EP-FX-REQ-001","case_id":"SYN-AI-FACT-001","jurisdiction":["EU/EEA","NL"],"evidence":[{"id":"EV-FX-001","kind":"document","source":"synthetic_scrubbed_portal.md","locator":"paragraph:1","excerpt":"Het interne medewerkersportaal verwerkt zakelijke profielgegevens voor accountbeheer.","content_hash":"synthetic:fx1","contains_personal_data":false,"metadata":{"scrubbed":true}},{"id":"EV-FX-002","kind":"document","source":"synthetic_scrubbed_hosting.md","locator":"paragraph:1","excerpt":"Hosting en support vinden binnen de EER plaats.","content_hash":"synthetic:fx2","contains_personal_data":false,"metadata":{"scrubbed":true}}],"facts":[{"id":"F-FX-001","fact_type":"processing_description","canonical_path":"processing_activities[PA-001].description","value":"Intern medewerkersportaal voor zakelijke profielgegevens en accountbeheer.","epistemic_status":"observed","confidence":0.91,"evidence_ids":["EV-FX-001"],"basis_summary":null,"review_status":"pending","sensitivity":"ordinary","notes":null,"validation_status":"provenance_validated","validator_notes":["support_proof:EV-FX-001"]},{"id":"F-FX-002","fact_type":"location","canonical_path":"processing_activities[PA-001].locations","value":{"hosting":"EEA","support":"EEA"},"epistemic_status":"inferred","confidence":0.88,"evidence_ids":["EV-FX-002"],"basis_summary":"Mapped the explicit hosting/support statement to the canonical location field.","review_status":"pending","sensitivity":"ordinary","notes":null,"validation_status":"provenance_validated","validator_notes":["support_proof:EV-FX-002"]}],"contradictions":[],"missing_information":[],"readiness":{"stage":"analysis","status":"needs_review","blockers":[],"rationale":"No hard blocker remains, but unresolved review signals require attention."},"human_review":{"required":true,"status":"pending","reviewer_role":"privacy_officer","reviewed_at":null,"rationale":null,"changes_required":[],"unresolved_issues":[]},"source_versions":["provider:fixture","model:fixture-privacy-extractor-v1","prompt:extract-facts-v1"],"notes":"Generated from policy-gated fact extraction; model output remains decision support."},"legal_context_request":{"id":"LC-REQ-DPIA-001","purpose":"dpia_analysis","jurisdiction":["EU/EEA","NL"],"as_of":"2026-08-10","max_verification_age_days":30,"required_rule_ids":["gdpr-art35-1-high-risk","gdpr-art35-2-dpo-advice","gdpr-art35-7-minimum-content","gdpr-art36-1-prior-consultation","edpb-wp248-two-criteria","nl-ap-list-mandatory-and-nonexhaustive"],"optional_source_ids":["nl-government-par-dpia-model","edpb-dpia-template-2026"],"include_nonfinal_context":true},"privacy_context":{"scrubbed":true,"scrub_key_present":false,"contains_direct_identifiers":false,"content_classification":"scrubbed_personal_data"},"requested_provider":"fixture","requested_model":"fixture-dpia-analyst-v1","prompt_version":"draft-dpia-v1"}